{"requirement_count":87,"requirements_sha256":"6db34703bc37ac52d57bc92235d311674cfc259cadf54fe6f55f73ee5d4bfd9e","rows":[{"authority":{"section":"Scope","source":"spec/NIP_DRAFT.md","text_sha256":"5546c5d60111cf4652e01015a0a0122429e7740928b8a721e2c445fd8bc31938"},"id":"NCRDT-SCOPE-001","rationale":"Operational, application, relay, acquisition, retention, or publication behavior outside the deterministic core libraries.","status":"out-of-core"},{"authority":{"section":"NIP-01 validation","source":"spec/NIP_DRAFT.md","text_sha256":"e162befeb3c40fbc30b7bad30ca0f25fd247ebb0ac1c063a52544e84493cda2c"},"id":"NCRDT-NIP01-001","proofs":{"rust":{"family":"nip01","implementation":"crates/nostr_automerge/src/wire/nip01/mod.rs","implementation_identity":"triesap/nostr_automerge","runner_job":"conformance","test":"crates/nostr_automerge/tests/nip01_conformance.rs"},"typescript":{"family":"nip01","implementation":"src/nip01.ts","implementation_identity":"triesap/nostr_automerge_typescript","runner_job":"conformance","test":"test/wire.test.ts"}},"status":"mandatory-pass"},{"authority":{"section":"NIP-01 validation","source":"spec/NIP_DRAFT.md","text_sha256":"0374ca8d9ebacd51b2381c6a142600dc2bbb69b44aef1ecd9b6d1b07587ca810"},"id":"NCRDT-NIP01-002","proofs":{"rust":{"family":"nip01","implementation":"crates/nostr_automerge/src/wire/nip01/mod.rs","implementation_identity":"triesap/nostr_automerge","runner_job":"conformance","test":"crates/nostr_automerge/tests/nip01_conformance.rs"},"typescript":{"family":"nip01","implementation":"src/nip01.ts","implementation_identity":"triesap/nostr_automerge_typescript","runner_job":"conformance","test":"test/wire.test.ts"}},"status":"mandatory-pass"},{"authority":{"section":"NIP-01 validation","source":"spec/NIP_DRAFT.md","text_sha256":"5cc14b80c8949fa3e067fb3eac68085c41a50fe3c31bf37a51df13d742a5ddbf"},"id":"NCRDT-NIP01-003","proofs":{"rust":{"family":"nip01","implementation":"crates/nostr_automerge/src/wire/nip01/mod.rs","implementation_identity":"triesap/nostr_automerge","runner_job":"conformance","test":"crates/nostr_automerge/tests/nip01_conformance.rs"},"typescript":{"family":"nip01","implementation":"src/nip01.ts","implementation_identity":"triesap/nostr_automerge_typescript","runner_job":"conformance","test":"test/wire.test.ts"}},"status":"mandatory-pass"},{"authority":{"section":"Acquisition channel","source":"spec/NIP_DRAFT.md","text_sha256":"ccac7d7e16f1c8d61305ec5ea944d3dfa9ccce95791e6d7f93bc0edcca87331c"},"id":"NCRDT-ACQ-001","proofs":{"rust":{"family":"manifest","implementation":"crates/nostr_automerge/src/carrier/manifest.rs","implementation_identity":"triesap/nostr_automerge","runner_job":"conformance","test":"crates/nostr_automerge/tests/public_engine_api.rs"},"typescript":{"family":"manifest","implementation":"src/carrier.ts","implementation_identity":"triesap/nostr_automerge_typescript","runner_job":"conformance","test":"test/carrier.test.ts"}},"status":"mandatory-pass"},{"authority":{"section":"Tags","source":"spec/NIP_DRAFT.md","text_sha256":"56ae232d1f8dd0ccb8fdc63aa474520f85b6a3f3faedf27d9472f64b0091e50a"},"id":"NCRDT-TAG-001","proofs":{"rust":{"family":"nip01","implementation":"crates/nostr_automerge/src/wire/nip01/mod.rs","implementation_identity":"triesap/nostr_automerge","runner_job":"conformance","test":"crates/nostr_automerge/tests/nip01_conformance.rs"},"typescript":{"family":"nip01","implementation":"src/nip01.ts","implementation_identity":"triesap/nostr_automerge_typescript","runner_job":"conformance","test":"test/wire.test.ts"}},"status":"mandatory-pass"},{"authority":{"section":"Tags","source":"spec/NIP_DRAFT.md","text_sha256":"ca2aa5cc60b349b0df22e9378821287423d7df65196f15cd7fdf9c1f14104dab"},"id":"NCRDT-TAG-002","proofs":{"rust":{"family":"nip01","implementation":"crates/nostr_automerge/src/wire/nip01/mod.rs","implementation_identity":"triesap/nostr_automerge","runner_job":"conformance","test":"crates/nostr_automerge/tests/nip01_conformance.rs"},"typescript":{"family":"nip01","implementation":"src/nip01.ts","implementation_identity":"triesap/nostr_automerge_typescript","runner_job":"conformance","test":"test/wire.test.ts"}},"status":"mandatory-pass"},{"authority":{"section":"Tags","source":"spec/NIP_DRAFT.md","text_sha256":"008312dd7b1e64e243a1294022c2d41dda7caf239f8ea3b876fb6c368c0053a2"},"id":"NCRDT-TAG-003","proofs":{"rust":{"family":"nip01","implementation":"crates/nostr_automerge/src/wire/nip01/mod.rs","implementation_identity":"triesap/nostr_automerge","runner_job":"conformance","test":"crates/nostr_automerge/tests/nip01_conformance.rs"},"typescript":{"family":"nip01","implementation":"src/nip01.ts","implementation_identity":"triesap/nostr_automerge_typescript","runner_job":"conformance","test":"test/wire.test.ts"}},"status":"mandatory-pass"},{"authority":{"section":"Canonical JSON","source":"spec/NIP_DRAFT.md","text_sha256":"cfc42ff88886945cf30cd584183b4483125973e54bb6bdac24bac9c91770bbc4"},"id":"NCRDT-JSON-001","proofs":{"rust":{"family":"nip01","implementation":"crates/nostr_automerge/src/wire/nip01/mod.rs","implementation_identity":"triesap/nostr_automerge","runner_job":"conformance","test":"crates/nostr_automerge/tests/nip01_conformance.rs"},"typescript":{"family":"nip01","implementation":"src/jcs.ts","implementation_identity":"triesap/nostr_automerge_typescript","runner_job":"conformance","test":"test/foundation.test.ts"}},"status":"mandatory-pass"},{"authority":{"section":"Canonical JSON","source":"spec/NIP_DRAFT.md","text_sha256":"b3b1a089edeb32ec7d3cc4e0c443c8d15287131bc07038df38cd5ad8e0c98cc1"},"id":"NCRDT-JSON-002","proofs":{"rust":{"family":"nip01","implementation":"crates/nostr_automerge/src/wire/nip01/mod.rs","implementation_identity":"triesap/nostr_automerge","runner_job":"conformance","test":"crates/nostr_automerge/tests/nip01_conformance.rs"},"typescript":{"family":"nip01","implementation":"src/jcs.ts","implementation_identity":"triesap/nostr_automerge_typescript","runner_job":"conformance","test":"test/foundation.test.ts"}},"status":"mandatory-pass"},{"authority":{"section":"Canonical JSON","source":"spec/NIP_DRAFT.md","text_sha256":"d4fa24364048e7ad4fa8a54adfb9df59225a7bf364e77a3e6df337e5937f1c19"},"id":"NCRDT-JSON-003","proofs":{"rust":{"family":"nip01","implementation":"crates/nostr_automerge/src/wire/nip01/mod.rs","implementation_identity":"triesap/nostr_automerge","runner_job":"conformance","test":"crates/nostr_automerge/tests/nip01_conformance.rs"},"typescript":{"family":"nip01","implementation":"src/jcs.ts","implementation_identity":"triesap/nostr_automerge_typescript","runner_job":"conformance","test":"test/foundation.test.ts"}},"status":"mandatory-pass"},{"authority":{"section":"Base64","source":"spec/NIP_DRAFT.md","text_sha256":"db7a0570ec2d533fc4ce3c82e5937a84192534583eca67a05a704fec8570cb21"},"id":"NCRDT-B64-001","proofs":{"rust":{"family":"nip01","implementation":"crates/nostr_automerge/src/wire/nip01/mod.rs","implementation_identity":"triesap/nostr_automerge","runner_job":"conformance","test":"crates/nostr_automerge/tests/nip01_conformance.rs"},"typescript":{"family":"nip01","implementation":"src/jcs.ts","implementation_identity":"triesap/nostr_automerge_typescript","runner_job":"conformance","test":"test/foundation.test.ts"}},"status":"mandatory-pass"},{"authority":{"section":"Interoperability limits","source":"spec/NIP_DRAFT.md","text_sha256":"a5460b3bcff6531d0ed202d538683d55f3a146376a4ae6129c83a64dd9c94a9f"},"id":"NCRDT-LIMIT-001","proofs":{"rust":{"family":"engine","implementation":"crates/nostr_automerge/src/engine/reference_evaluator.rs","implementation_identity":"triesap/nostr_automerge","runner_job":"conformance","test":"crates/nostr_automerge/tests/public_engine_api.rs"},"typescript":{"family":"engine","implementation":"src/evaluator.ts","implementation_identity":"triesap/nostr_automerge_typescript","runner_job":"conformance","test":"test/evaluator.test.ts"}},"status":"mandatory-pass"},{"authority":{"section":"Document identity and lifecycle","source":"spec/NIP_DRAFT.md","text_sha256":"3e63d54fbb1be231f6ff46dc8a7f47ff75c2fe3a5a7885f3c7de28f6ac387a32"},"id":"NCRDT-DOC-001","rationale":"Operational, application, relay, acquisition, retention, or publication behavior outside the deterministic core libraries.","status":"out-of-core"},{"authority":{"section":"Device keys and Automerge actors","source":"spec/NIP_DRAFT.md","text_sha256":"276b92da531ffde9254c0e148ce4529b40cab9507860a558470cc494b6d36d1c"},"id":"NCRDT-ACTOR-001","rationale":"Operational, application, relay, acquisition, retention, or publication behavior outside the deterministic core libraries.","status":"out-of-core"},{"authority":{"section":"Device keys and Automerge actors","source":"spec/NIP_DRAFT.md","text_sha256":"4b7867246f234ce38c734365489b8aa0817c26d1470a145e5c228b640039c05f"},"id":"NCRDT-ACTOR-002","proofs":{"rust":{"family":"change_graph","implementation":"crates/nostr_automerge/src/authoring/mod.rs","implementation_identity":"triesap/nostr_automerge","runner_job":"conformance","test":"crates/nostr_automerge/tests/authoring_roundtrip.rs"},"typescript":{"family":"change_graph","implementation":"src/actor.ts","implementation_identity":"triesap/nostr_automerge_typescript","runner_job":"conformance","test":"test/foundation.test.ts"}},"status":"mandatory-pass"},{"authority":{"section":"Device keys and Automerge actors","source":"spec/NIP_DRAFT.md","text_sha256":"e8162aa127c04af3609363274f2f1d069ee65c1f2abb903ba4b829304fd596a0"},"id":"NCRDT-ACTOR-003","rationale":"Operational, application, relay, acquisition, retention, or publication behavior outside the deterministic core libraries.","status":"out-of-core"},{"authority":{"section":"Change Chunk framing","source":"spec/NIP_DRAFT.md","text_sha256":"e28bd7f43f12dd9145369ee6550ed42a81d2282fdaa8fed59b21428d7dc4e662"},"id":"NCRDT-FRAME-001","proofs":{"rust":{"family":"change_graph","implementation":"crates/nostr_automerge/src/automerge_adapter/mod.rs","implementation_identity":"triesap/nostr_automerge